{
  "$schema": "../../../../schemas/concept-skill.schema.json",
  "schema_version": 1,
  "version": 1,
  "skill_name": "tkl-exhaustion-gap",
  "concept_id": "price-action-and-technical-analysis/exhaustion-gap",
  "display_name": "Exhaustion gap",
  "domain": "Price action and technical analysis",
  "description": "Explain, compare, or apply Exhaustion gap using the library's structured Price action and technical analysis reference, including failure modes and misconceptions.",
  "trigger_phrases": [
    "Exhaustion gap",
    "explain Exhaustion gap",
    "apply Exhaustion gap to a trading question",
    "common misconception about Exhaustion gap"
  ],
  "supported_intents": [
    "explain",
    "compare",
    "apply",
    "diagnose-misconception"
  ],
  "context_requirements": {
    "required": [
      "the user's question or claim",
      "the intended analysis context"
    ],
    "optional": [
      "market and venue",
      "timeframe",
      "current observations",
      "risk constraints",
      "indicator parameters",
      "trend and volatility regime"
    ]
  },
  "workflow": [
    "Identify whether the request asks to explain, compare, apply, or diagnose a misconception.",
    "Read references/concept.json and verify its canonical_sha256 matches this profile.",
    "Use the definition, mechanics, relationships, and citations as sourced facts.",
    "Request or label missing context before applying the concept to a market situation.",
    "Separate sourced facts from analytical inferences and unknown live conditions.",
    "State the concept's failure modes and misconceptions before giving a practical implication.",
    "Cite the carried sources and return JSON when the user requests machine-readable output."
  ],
  "constraints": [
    "Do not invent live market data, venue rules, or user positions.",
    "Do not place orders or claim certainty or guaranteed profitability.",
    "Do not present educational analysis as personalized financial advice.",
    "Do not treat the concept alone as a complete entry, exit, or sizing rule.",
    "Flag stale or venue-specific facts that require current official documentation."
  ],
  "output_contract": {
    "format": "human-readable-or-json-on-request",
    "required_fields": [
      "concept_id",
      "intent",
      "summary",
      "facts",
      "inferences",
      "unknowns",
      "failure_modes",
      "misconceptions",
      "citations",
      "warning"
    ]
  },
  "core": false,
  "batch_number": 32,
  "package_path": "skills/concepts/price-action-and-technical-analysis/exhaustion-gap",
  "canonical": {
    "source_path": "concepts/price-action-and-technical-analysis.json",
    "sha256": "7384a15f9264acf9545aa661f162b453fe93218220c3408bd3a4511d8c0e1e4c"
  },
  "related_concept_ids": [
    "price-action-and-technical-analysis/gap",
    "price-action-and-technical-analysis/runaway-gap",
    "price-action-and-technical-analysis/gap-up",
    "price-action-and-technical-analysis/gap-down"
  ]
}
