{
  "$schema": "../../../../schemas/concept-skill.schema.json",
  "schema_version": 1,
  "version": 1,
  "skill_name": "tkl-initiative-buying",
  "concept_id": "volume-and-order-flow/initiative-buying",
  "display_name": "Initiative buying",
  "domain": "Volume and order flow",
  "description": "Explain, compare, or apply Initiative buying using the library's structured Volume and order flow reference, including failure modes and misconceptions.",
  "trigger_phrases": [
    "Initiative buying",
    "initiative buying activity",
    "IB (initiative buying)",
    "explain Initiative buying",
    "apply Initiative buying to a trading question",
    "common misconception about Initiative buying"
  ],
  "supported_intents": [
    "explain",
    "compare",
    "apply",
    "diagnose-misconception"
  ],
  "context_requirements": {
    "required": [
      "the user's question or claim",
      "the intended analysis context"
    ],
    "optional": [
      "market and venue",
      "timeframe",
      "current observations",
      "risk constraints",
      "order type",
      "spread and liquidity conditions"
    ]
  },
  "workflow": [
    "Identify whether the request asks to explain, compare, apply, or diagnose a misconception.",
    "Read references/concept.json and verify its canonical_sha256 matches this profile.",
    "Use the definition, mechanics, relationships, and citations as sourced facts.",
    "Request or label missing context before applying the concept to a market situation.",
    "Separate sourced facts from analytical inferences and unknown live conditions.",
    "State the concept's failure modes and misconceptions before giving a practical implication.",
    "Cite the carried sources and return JSON when the user requests machine-readable output."
  ],
  "constraints": [
    "Do not invent live market data, venue rules, or user positions.",
    "Do not place orders or claim certainty or guaranteed profitability.",
    "Do not present educational analysis as personalized financial advice.",
    "Do not treat the concept alone as a complete entry, exit, or sizing rule.",
    "Flag stale or venue-specific facts that require current official documentation."
  ],
  "output_contract": {
    "format": "human-readable-or-json-on-request",
    "required_fields": [
      "concept_id",
      "intent",
      "summary",
      "facts",
      "inferences",
      "unknowns",
      "failure_modes",
      "misconceptions",
      "citations",
      "warning"
    ]
  },
  "core": false,
  "batch_number": 43,
  "package_path": "skills/concepts/volume-and-order-flow/initiative-buying",
  "canonical": {
    "source_path": "concepts/volume-and-order-flow.json",
    "sha256": "2fb70936c307ab062357f220f691afa5e3ac91f7b777fd593eb315e8c7042177"
  },
  "related_concept_ids": [
    "volume-and-order-flow/initiative-selling",
    "volume-and-order-flow/responsive-buying",
    "volume-and-order-flow/responsive-selling",
    "volume-and-order-flow/trend-day",
    "volume-and-order-flow/acceptance"
  ]
}
