{
  "$schema": "../../../../schemas/concept-skill.schema.json",
  "schema_version": 1,
  "version": 1,
  "skill_name": "tkl-daily-review",
  "concept_id": "psychology-and-process/daily-review",
  "display_name": "Daily review",
  "domain": "Psychology and process",
  "description": "Explain, compare, or apply Daily review using the library's structured Psychology and process reference, including failure modes and misconceptions.",
  "trigger_phrases": [
    "Daily review",
    "End-of-day review",
    "explain Daily review",
    "apply Daily review to a trading question",
    "common misconception about Daily review"
  ],
  "supported_intents": [
    "explain",
    "compare",
    "apply",
    "diagnose-misconception"
  ],
  "context_requirements": {
    "required": [
      "the user's question or claim",
      "the intended analysis context"
    ],
    "optional": [
      "market and venue",
      "timeframe",
      "current observations",
      "risk constraints"
    ]
  },
  "workflow": [
    "Identify whether the request asks to explain, compare, apply, or diagnose a misconception.",
    "Read references/concept.json and verify its canonical_sha256 matches this profile.",
    "Use the definition, mechanics, relationships, and citations as sourced facts.",
    "Request or label missing context before applying the concept to a market situation.",
    "Separate sourced facts from analytical inferences and unknown live conditions.",
    "State the concept's failure modes and misconceptions before giving a practical implication.",
    "Cite the carried sources and return JSON when the user requests machine-readable output."
  ],
  "constraints": [
    "Do not invent live market data, venue rules, or user positions.",
    "Do not place orders or claim certainty or guaranteed profitability.",
    "Do not present educational analysis as personalized financial advice.",
    "Do not treat the concept alone as a complete entry, exit, or sizing rule.",
    "Flag stale or venue-specific facts that require current official documentation."
  ],
  "output_contract": {
    "format": "human-readable-or-json-on-request",
    "required_fields": [
      "concept_id",
      "intent",
      "summary",
      "facts",
      "inferences",
      "unknowns",
      "failure_modes",
      "misconceptions",
      "citations",
      "warning"
    ]
  },
  "core": false,
  "batch_number": 70,
  "package_path": "skills/concepts/psychology-and-process/daily-review",
  "canonical": {
    "source_path": "concepts/psychology-and-process.json",
    "sha256": "20d646d6262380c6d7c7a9ff87462d6c9f3dfeddc65a4b5f5991941eb50f674a"
  },
  "related_concept_ids": [
    "psychology-and-process/weekly-review",
    "psychology-and-process/trading-journal",
    "psychology-and-process/post-trade-review",
    "psychology-and-process/rule-adherence",
    "psychology-and-process/process-metric"
  ]
}
