{
  "$schema": "https://unperson-12359.github.io/trading-knowledge-library/schemas/concept-skill.schema.json",
  "schema_version": 1,
  "version": 1,
  "skill_name": "tkl-realized-spread",
  "concept_id": "microstructure/realized-spread",
  "display_name": "Realized spread",
  "domain": "Microstructure",
  "description": "Explain, compare, or apply Realized spread using the library's structured Microstructure reference, including failure modes and misconceptions.",
  "trigger_phrases": [
    "Realized spread",
    "post-trade spread",
    "explain Realized spread",
    "apply Realized spread to a trading question",
    "common misconception about Realized spread"
  ],
  "supported_intents": [
    "explain",
    "compare",
    "apply",
    "diagnose-misconception"
  ],
  "context_requirements": {
    "required": [
      "the user's question or claim",
      "the intended analysis context"
    ],
    "optional": [
      "market and venue",
      "timeframe",
      "current observations",
      "risk constraints",
      "order type",
      "spread and liquidity conditions"
    ]
  },
  "workflow": [
    "Identify whether the request asks to explain, compare, apply, or diagnose a misconception.",
    "Read references/concept.json and verify its canonical_sha256 matches this profile.",
    "Use the definition, mechanics, relationships, and citations as sourced facts.",
    "Request or label missing context before applying the concept to a market situation.",
    "Separate sourced facts from analytical inferences and unknown live conditions.",
    "State the concept's failure modes and misconceptions before giving a practical implication.",
    "Cite the carried sources and return JSON when the user requests machine-readable output."
  ],
  "constraints": [
    "Do not invent live market data, venue rules, or user positions.",
    "Do not place orders or claim certainty or guaranteed profitability.",
    "Do not present educational analysis as personalized financial advice.",
    "Do not treat the concept alone as a complete entry, exit, or sizing rule.",
    "Flag stale or venue-specific facts that require current official documentation."
  ],
  "output_contract": {
    "format": "human-readable-or-json-on-request",
    "required_fields": [
      "concept_id",
      "intent",
      "summary",
      "facts",
      "inferences",
      "unknowns",
      "failure_modes",
      "misconceptions",
      "citations",
      "warning"
    ]
  },
  "core": false,
  "batch_number": 14,
  "package_path": "skills/concepts/microstructure/realized-spread",
  "canonical": {
    "source_path": "concepts/microstructure.json",
    "sha256": "3dd3489d7d0c3808150347dcfb8dd5c80894950c552e2790399e45e389696289"
  },
  "related_concept_ids": [
    "microstructure/effective-spread",
    "microstructure/quoted-spread",
    "microstructure/adverse-selection",
    "microstructure/midpoint"
  ]
}
