{
  "$schema": "https://unperson-12359.github.io/trading-knowledge-library/schemas/concept-skill.schema.json",
  "schema_version": 1,
  "version": 1,
  "skill_name": "tkl-deleveraging",
  "concept_id": "risk-and-performance/deleveraging",
  "display_name": "Deleveraging",
  "domain": "Risk and performance",
  "description": "Explain, compare, or apply Deleveraging using the library's structured Risk and performance reference, including failure modes and misconceptions.",
  "trigger_phrases": [
    "Deleveraging",
    "de-gearing",
    "explain Deleveraging",
    "apply Deleveraging to a trading question",
    "common misconception about Deleveraging"
  ],
  "supported_intents": [
    "explain",
    "compare",
    "apply",
    "diagnose-misconception"
  ],
  "context_requirements": {
    "required": [
      "the user's question or claim",
      "the intended analysis context"
    ],
    "optional": [
      "market and venue",
      "timeframe",
      "current observations",
      "risk constraints"
    ]
  },
  "workflow": [
    "Identify whether the request asks to explain, compare, apply, or diagnose a misconception.",
    "Read references/concept.json and verify its canonical_sha256 matches this profile.",
    "Use the definition, mechanics, relationships, and citations as sourced facts.",
    "Request or label missing context before applying the concept to a market situation.",
    "Separate sourced facts from analytical inferences and unknown live conditions.",
    "State the concept's failure modes and misconceptions before giving a practical implication.",
    "Cite the carried sources and return JSON when the user requests machine-readable output."
  ],
  "constraints": [
    "Do not invent live market data, venue rules, or user positions.",
    "Do not place orders or claim certainty or guaranteed profitability.",
    "Do not present educational analysis as personalized financial advice.",
    "Do not treat the concept alone as a complete entry, exit, or sizing rule.",
    "Flag stale or venue-specific facts that require current official documentation."
  ],
  "output_contract": {
    "format": "human-readable-or-json-on-request",
    "required_fields": [
      "concept_id",
      "intent",
      "summary",
      "facts",
      "inferences",
      "unknowns",
      "failure_modes",
      "misconceptions",
      "citations",
      "warning"
    ]
  },
  "core": false,
  "batch_number": 27,
  "package_path": "skills/concepts/risk-and-performance/deleveraging",
  "canonical": {
    "source_path": "concepts/risk-and-performance.json",
    "sha256": "ca075f98a7b9566331768713f1b5517eedc1617bbab72227c1dd1291a2c184f1"
  },
  "related_concept_ids": [
    "risk-and-performance/leverage",
    "risk-and-performance/effective-leverage",
    "risk-and-performance/forced-liquidation",
    "risk-and-performance/margin-call",
    "risk-and-performance/funding-liquidity-risk",
    "risk-and-performance/gross-exposure"
  ]
}
