{
  "$schema": "../../../../schemas/concept-skill.schema.json",
  "schema_version": 1,
  "version": 1,
  "skill_name": "tkl-hammer",
  "concept_id": "candlestick-patterns/hammer",
  "display_name": "Hammer",
  "domain": "Candlestick patterns",
  "description": "Explain, compare, or apply Hammer using the library's structured Candlestick patterns reference, including failure modes and misconceptions.",
  "trigger_phrases": [
    "Hammer",
    "explain Hammer",
    "apply Hammer to a trading question",
    "common misconception about Hammer"
  ],
  "supported_intents": [
    "explain",
    "compare",
    "apply",
    "diagnose-misconception"
  ],
  "context_requirements": {
    "required": [
      "the user's question or claim",
      "the intended analysis context"
    ],
    "optional": [
      "market and venue",
      "timeframe",
      "current observations",
      "risk constraints",
      "indicator parameters",
      "trend and volatility regime"
    ]
  },
  "workflow": [
    "Identify whether the request asks to explain, compare, apply, or diagnose a misconception.",
    "Read references/concept.json and verify its canonical_sha256 matches this profile.",
    "Use the definition, mechanics, relationships, and citations as sourced facts.",
    "Request or label missing context before applying the concept to a market situation.",
    "Separate sourced facts from analytical inferences and unknown live conditions.",
    "State the concept's failure modes and misconceptions before giving a practical implication.",
    "Cite the carried sources and return JSON when the user requests machine-readable output."
  ],
  "constraints": [
    "Do not invent live market data, venue rules, or user positions.",
    "Do not place orders or claim certainty or guaranteed profitability.",
    "Do not present educational analysis as personalized financial advice.",
    "Do not treat the concept alone as a complete entry, exit, or sizing rule.",
    "Flag stale or venue-specific facts that require current official documentation."
  ],
  "output_contract": {
    "format": "human-readable-or-json-on-request",
    "required_fields": [
      "concept_id",
      "intent",
      "summary",
      "facts",
      "inferences",
      "unknowns",
      "failure_modes",
      "misconceptions",
      "citations",
      "warning"
    ]
  },
  "core": false,
  "batch_number": 34,
  "package_path": "skills/concepts/candlestick-patterns/hammer",
  "canonical": {
    "source_path": "concepts/candlestick-patterns.json",
    "sha256": "5b954c12e762195cb1237a079213c870b1857c62bbda9e54f6b8a66f1fb521fc"
  },
  "related_concept_ids": [
    "candlestick-patterns/hanging-man",
    "candlestick-patterns/inverted-hammer",
    "candlestick-patterns/shooting-star",
    "candlestick-patterns/pin-bar",
    "candlestick-patterns/dragonfly-doji"
  ]
}
