{
  "$schema": "https://unperson-12359.github.io/trading-knowledge-library/schemas/concept-skill.schema.json",
  "schema_version": 1,
  "version": 1,
  "skill_name": "tkl-law-of-supply-and-demand",
  "concept_id": "wyckoff/law-of-supply-and-demand",
  "display_name": "Law of supply and demand",
  "domain": "Wyckoff",
  "description": "Explain, compare, or apply Law of supply and demand using the library's structured Wyckoff reference, including failure modes and misconceptions.",
  "trigger_phrases": [
    "Law of supply and demand",
    "Wyckoff's first law",
    "explain Law of supply and demand",
    "apply Law of supply and demand to a trading question",
    "common misconception about Law of supply and demand"
  ],
  "supported_intents": [
    "explain",
    "compare",
    "apply",
    "diagnose-misconception"
  ],
  "context_requirements": {
    "required": [
      "the user's question or claim",
      "the intended analysis context"
    ],
    "optional": [
      "market and venue",
      "timeframe",
      "current observations",
      "risk constraints"
    ]
  },
  "workflow": [
    "Identify whether the request asks to explain, compare, apply, or diagnose a misconception.",
    "Read references/concept.json and verify its canonical_sha256 matches this profile.",
    "Use the definition, mechanics, relationships, and citations as sourced facts.",
    "Request or label missing context before applying the concept to a market situation.",
    "Separate sourced facts from analytical inferences and unknown live conditions.",
    "State the concept's failure modes and misconceptions before giving a practical implication.",
    "Cite the carried sources and return JSON when the user requests machine-readable output."
  ],
  "constraints": [
    "Do not invent live market data, venue rules, or user positions.",
    "Do not place orders or claim certainty or guaranteed profitability.",
    "Do not present educational analysis as personalized financial advice.",
    "Do not treat the concept alone as a complete entry, exit, or sizing rule.",
    "Flag stale or venue-specific facts that require current official documentation."
  ],
  "output_contract": {
    "format": "human-readable-or-json-on-request",
    "required_fields": [
      "concept_id",
      "intent",
      "summary",
      "facts",
      "inferences",
      "unknowns",
      "failure_modes",
      "misconceptions",
      "citations",
      "warning"
    ]
  },
  "core": false,
  "batch_number": 44,
  "package_path": "skills/concepts/wyckoff/law-of-supply-and-demand",
  "canonical": {
    "source_path": "concepts/wyckoff.json",
    "sha256": "f3c8d96e20b8d23cca5010dbe54af7751aa8329eeb2d01529d48b803d1650421"
  },
  "related_concept_ids": [
    "wyckoff/law-of-cause-and-effect",
    "wyckoff/law-of-effort-versus-result",
    "wyckoff/wyckoff-method",
    "wyckoff/no-demand",
    "wyckoff/no-supply"
  ]
}
