{
  "$schema": "https://unperson-12359.github.io/trading-knowledge-library/schemas/concept-skill.schema.json",
  "schema_version": 1,
  "version": 1,
  "skill_name": "tkl-variance-swap",
  "concept_id": "instruments/variance-swap",
  "display_name": "Variance swap",
  "domain": "Instruments",
  "description": "Explain, compare, or apply Variance swap using the library's structured Instruments reference, including failure modes and misconceptions.",
  "trigger_phrases": [
    "Variance swap",
    "Var swap",
    "explain Variance swap",
    "apply Variance swap to a trading question",
    "common misconception about Variance swap"
  ],
  "supported_intents": [
    "explain",
    "compare",
    "apply",
    "diagnose-misconception"
  ],
  "context_requirements": {
    "required": [
      "the user's question or claim",
      "the intended analysis context"
    ],
    "optional": [
      "market and venue",
      "timeframe",
      "current observations",
      "risk constraints"
    ]
  },
  "workflow": [
    "Identify whether the request asks to explain, compare, apply, or diagnose a misconception.",
    "Read references/concept.json and verify its canonical_sha256 matches this profile.",
    "Use the definition, mechanics, relationships, and citations as sourced facts.",
    "Request or label missing context before applying the concept to a market situation.",
    "Separate sourced facts from analytical inferences and unknown live conditions.",
    "State the concept's failure modes and misconceptions before giving a practical implication.",
    "Cite the carried sources and return JSON when the user requests machine-readable output."
  ],
  "constraints": [
    "Do not invent live market data, venue rules, or user positions.",
    "Do not place orders or claim certainty or guaranteed profitability.",
    "Do not present educational analysis as personalized financial advice.",
    "Do not treat the concept alone as a complete entry, exit, or sizing rule.",
    "Flag stale or venue-specific facts that require current official documentation."
  ],
  "output_contract": {
    "format": "human-readable-or-json-on-request",
    "required_fields": [
      "concept_id",
      "intent",
      "summary",
      "facts",
      "inferences",
      "unknowns",
      "failure_modes",
      "misconceptions",
      "citations",
      "warning"
    ]
  },
  "core": false,
  "batch_number": 9,
  "package_path": "skills/concepts/instruments/variance-swap",
  "canonical": {
    "source_path": "concepts/instruments.json",
    "sha256": "6c12aadf3f22128df3b94437155b4e71ec4acc9f24e8c03902f0b39c0861c774"
  },
  "related_concept_ids": [
    "instruments/volatility-swap",
    "instruments/option",
    "instruments/swap"
  ]
}
