{
  "$schema": "https://unperson-12359.github.io/trading-knowledge-library/schemas/concept-skill.schema.json",
  "schema_version": 1,
  "version": 1,
  "skill_name": "tkl-commitments-of-traders-report",
  "concept_id": "futures-and-spreads/commitments-of-traders-report",
  "display_name": "Commitments of Traders report",
  "domain": "Futures and spreads",
  "description": "Explain, compare, or apply Commitments of Traders report using the library's structured Futures and spreads reference, including failure modes and misconceptions.",
  "trigger_phrases": [
    "Commitments of Traders report",
    "COT report",
    "COT",
    "explain Commitments of Traders report",
    "apply Commitments of Traders report to a trading question",
    "common misconception about Commitments of Traders report"
  ],
  "supported_intents": [
    "explain",
    "compare",
    "apply",
    "diagnose-misconception"
  ],
  "context_requirements": {
    "required": [
      "the user's question or claim",
      "the intended analysis context"
    ],
    "optional": [
      "market and venue",
      "timeframe",
      "current observations",
      "risk constraints"
    ]
  },
  "workflow": [
    "Identify whether the request asks to explain, compare, apply, or diagnose a misconception.",
    "Read references/concept.json and verify its canonical_sha256 matches this profile.",
    "Use the definition, mechanics, relationships, and citations as sourced facts.",
    "Request or label missing context before applying the concept to a market situation.",
    "Separate sourced facts from analytical inferences and unknown live conditions.",
    "State the concept's failure modes and misconceptions before giving a practical implication.",
    "Cite the carried sources and return JSON when the user requests machine-readable output."
  ],
  "constraints": [
    "Do not invent live market data, venue rules, or user positions.",
    "Do not place orders or claim certainty or guaranteed profitability.",
    "Do not present educational analysis as personalized financial advice.",
    "Do not treat the concept alone as a complete entry, exit, or sizing rule.",
    "Flag stale or venue-specific facts that require current official documentation."
  ],
  "output_contract": {
    "format": "human-readable-or-json-on-request",
    "required_fields": [
      "concept_id",
      "intent",
      "summary",
      "facts",
      "inferences",
      "unknowns",
      "failure_modes",
      "misconceptions",
      "citations",
      "warning"
    ]
  },
  "core": false,
  "batch_number": 50,
  "package_path": "skills/concepts/futures-and-spreads/commitments-of-traders-report",
  "canonical": {
    "source_path": "concepts/futures-and-spreads.json",
    "sha256": "7f2dbc54d9bcea837f00b69c427b55dcb9a06b0f9cc3f218f9320b2538d540b2"
  },
  "related_concept_ids": [
    "futures-and-spreads/commercial-trader",
    "futures-and-spreads/noncommercial-trader",
    "futures-and-spreads/managed-money",
    "futures-and-spreads/producer-merchant-processor-user",
    "futures-and-spreads/swap-dealer-category",
    "futures-and-spreads/open-interest-change"
  ]
}
