{
  "$schema": "../../../../schemas/concept-skill.schema.json",
  "schema_version": 1,
  "version": 1,
  "skill_name": "tkl-weekly-loss-limit",
  "concept_id": "risk-and-performance/weekly-loss-limit",
  "display_name": "Weekly loss limit",
  "domain": "Risk and performance",
  "description": "Explain, compare, or apply Weekly loss limit using the library's structured Risk and performance reference, including failure modes and misconceptions.",
  "trigger_phrases": [
    "Weekly loss limit",
    "weekly drawdown limit",
    "max weekly loss",
    "explain Weekly loss limit",
    "apply Weekly loss limit to a trading question",
    "common misconception about Weekly loss limit"
  ],
  "supported_intents": [
    "explain",
    "compare",
    "apply",
    "diagnose-misconception"
  ],
  "context_requirements": {
    "required": [
      "the user's question or claim",
      "the intended analysis context"
    ],
    "optional": [
      "market and venue",
      "timeframe",
      "current observations",
      "risk constraints"
    ]
  },
  "workflow": [
    "Identify whether the request asks to explain, compare, apply, or diagnose a misconception.",
    "Read references/concept.json and verify its canonical_sha256 matches this profile.",
    "Use the definition, mechanics, relationships, and citations as sourced facts.",
    "Request or label missing context before applying the concept to a market situation.",
    "Separate sourced facts from analytical inferences and unknown live conditions.",
    "State the concept's failure modes and misconceptions before giving a practical implication.",
    "Cite the carried sources and return JSON when the user requests machine-readable output."
  ],
  "constraints": [
    "Do not invent live market data, venue rules, or user positions.",
    "Do not place orders or claim certainty or guaranteed profitability.",
    "Do not present educational analysis as personalized financial advice.",
    "Do not treat the concept alone as a complete entry, exit, or sizing rule.",
    "Flag stale or venue-specific facts that require current official documentation."
  ],
  "output_contract": {
    "format": "human-readable-or-json-on-request",
    "required_fields": [
      "concept_id",
      "intent",
      "summary",
      "facts",
      "inferences",
      "unknowns",
      "failure_modes",
      "misconceptions",
      "citations",
      "warning"
    ]
  },
  "core": false,
  "batch_number": 26,
  "package_path": "skills/concepts/risk-and-performance/weekly-loss-limit",
  "canonical": {
    "source_path": "concepts/risk-and-performance.json",
    "sha256": "f90c446864a77ecd9908ab0e9fd69442c1dec02390f59766f4c3f1f12210111a"
  },
  "related_concept_ids": [
    "risk-and-performance/daily-loss-limit",
    "risk-and-performance/risk-limit",
    "risk-and-performance/maximum-drawdown",
    "risk-and-performance/position-sizing"
  ]
}
